{
  "format": "aiaeao.cube.vp03-print-report/1",
  "lens_profile": "P2-VP-LENSES/0.3.0",
  "reference_version": "v9.4",
  "view": "cube.diagramm",
  "lens": "cube.lens.execution",
  "granularity": "standard",
  "source_view_sha256": "309d8e41e37af240fd16ef3fd95b10d76cee2da3a58681430585e44c3b71c2c1",
  "base_view_svg_sha256": "a1f1758fd04e35cc5f575d53b989f9c725460e315723311dae1f69c5606d8a1a",
  "svg_sha256": "e837c7e104f816e96046eae47c5afc030506c8fcfea14e7244d62c054be65b17",
  "render_status": "PASS",
  "focus_status": "declared_unverified",
  "highlighted": [
    {
      "lens": "cube.lens.execution",
      "target_kind": "sample",
      "target_id": "revisions",
      "declaration_ref": "fixture:VP03/chart_inventory/execution/sample/revisions",
      "note": "Illustrative operational-planning emphasis",
      "basis": "declared_unverified"
    }
  ],
  "original_vp02_report": {
    "format": "aiaeao.cube.vp02-print-report/1",
    "printer_profile": "P2-VP-VIEWS/0.2.0",
    "reference_version": "v9.4",
    "view": "cube.diagramm",
    "lens": "neutral",
    "granularity": "standard",
    "render_status": "PASS",
    "svg_sha256": "a1f1758fd04e35cc5f575d53b989f9c725460e315723311dae1f69c5606d8a1a",
    "semantic_conformance": "NOT_EVALUATED",
    "epistemic_warrant": "NOT_EVALUATED",
    "current_authority": "NOT_EVALUATED",
    "canonical_admission": "NOT_EVALUATED",
    "content_status": "declared_unverified",
    "notices": [
      "All source declarations are unverified presentation inputs.",
      "Layout order, geometry, color and arrowheads do not assert semantic typing, causation or time truth."
    ],
    "sample_ids": [
      "artifact",
      "source",
      "evidence",
      "revisions"
    ],
    "measurement_ref": "fixture:VP02/measurements/resource-counts-v1",
    "unit": "items"
  },
  "content_status": "declared_unverified",
  "semantic_conformance": "NOT_EVALUATED",
  "epistemic_warrant": "NOT_EVALUATED",
  "current_authority": "NOT_EVALUATED",
  "canonical_admission": "NOT_EVALUATED",
  "notices": [
    "Every source element remains visible; VP-03 changes visual emphasis only.",
    "Facet bindings are authored display declarations, not evidence of operational facts.",
    "Lens color, form, layout and focus neither grant authority nor assert truth."
  ]
}
